{
  "schema": "folder-sync-pulls/1",
  "project": "notes",
  "host_id": "b55e9683-7854-4121-a56a-9bae7c3ab1da",
  "host_name": "bam-GPU",
  "at": "2026-10-28T20:47:30.130Z",
  "events": [
    {
      "schema": "folder-sync-event/1",
      "event": "download",
      "at": "2026-10-28T20:47:30.120Z",
      "level": "info",
      "project": "notes",
      "host": "b55e9683-7854-4121-a56a-9bae7c3ab1da",
      "host_name": "bam-GPU",
      "peer": "e2a0b1c2-d3e4-4f50-9a1b-2c3d4e5f6a7b",
      "peer_name": "web",
      "path": "hearts/clamp-24.json",
      "size": 233,
      "peer_seq": 6,
      "down_ms": 1318
    },
    {
      "schema": "folder-sync-event/1",
      "event": "remove_copy",
      "at": "2026-10-28T20:47:30.121Z",
      "level": "info",
      "project": "notes",
      "host": "b55e9683-7854-4121-a56a-9bae7c3ab1da",
      "host_name": "bam-GPU",
      "peer": "e2a0b1c2-d3e4-4f50-9a1b-2c3d4e5f6a7b",
      "peer_name": "web",
      "path": "hearts/old-draft.json",
      "peer_seq": 6,
      "down_ms": 1319
    }
  ]
}
